[
  {
    "id": "kb_toan10_01",
    "grade": "Toán 10",
    "chapter": "Chương 1: Mệnh đề & Tập hợp",
    "title": "Mệnh đề, Tập hợp và Các phép toán trên tập hợp",
    "overview": "Nền tảng của tư duy logic toán học, cấu trúc dữ liệu và bài toán đếm bù trừ.",
    "theory_markdown": "### 1. Mệnh đề toán học và Mệnh đề phủ định\nMột mệnh đề là một khẳng định đúng hoặc sai, không thể vừa đúng vừa sai.\n- Mệnh đề kéo theo: \\(P \\implies Q\\) chỉ sai khi \\(P\\) đúng và \\(Q\\) sai.\n- Mệnh đề đảo của \\(P \\implies Q\\) là \\(Q \\implies P\\).\n- Mệnh đề phản đảo: \\(\\overline{Q} \\implies \\overline{P}\\) (có cùng giá trị chân lý với \\(P \\implies Q\\)).\n\n### 2. Các phép toán trên tập hợp\n- **Giao**: \\(A \\cap B = \\{x \\mid x \\in A \\text{ và } x \\in B\\}\\).\n- **Hợp**: \\(A \\cup B = \\{x \\mid x \\in A \\text{ hoặc } x \\in B\\}\\).\n- **Hiệu**: \\(A \\setminus B = \\{x \\mid x \\in A \\text{ và } x \\notin B\\}\\).\n- **Phần bù**: \\(C_E A = E \\setminus A\\) (với \\(A \\subset E\\)).",
    "formulas": [
      {
        "id": "kb_toan10_01_f1",
        "name": "Nguyên lý bù trừ 2 tập",
        "latex": "|A \\cup B| = |A| + |B| - |A \\cap B|",
        "desc": "Tính số phần tử của hợp hai tập hữu hạn",
        "tags": [
          "Tập hợp",
          "Đếm"
        ],
        "constraints": [
          "Áp dụng trong tập xác định chuẩn của các hàm số thành phần"
        ]
      },
      {
        "id": "kb_toan10_01_f2",
        "name": "Nguyên lý bù trừ 3 tập",
        "latex": "|A \\cup B \\cup C| = |A|+|B|+|C| - (|A \\cap B| + |B \\cap C| + |C \\cap A|) + |A \\cap B \\cap C|",
        "desc": "Tính số phần tử khi có 3 tập giao nhau",
        "tags": [
          "Tập hợp",
          "Xác suất"
        ],
        "constraints": [
          "Áp dụng trong tập xác định chuẩn của các hàm số thành phần"
        ]
      },
      {
        "id": "kb_toan10_01_f3",
        "name": "Điều kiện hai khoảng giao khác rỗng",
        "latex": "(a; b) \\cap (c; d) \\ne \\emptyset \\iff a < d \\text{ và } c < b",
        "desc": "Điều kiện để hai khoảng số thực giao nhau khác rỗng",
        "tags": [
          "Số thực",
          "Khoảng đoạn"
        ],
        "constraints": [
          "Áp dụng trong tập xác định chuẩn của các hàm số thành phần"
        ]
      }
    ],
    "formula_ids": [
      "kb_toan10_01_f1",
      "kb_toan10_01_f2",
      "kb_toan10_01_f3"
    ],
    "prerequisites": [],
    "related_topics": [
      "kb_toan10_02",
      "kb_toan11_03"
    ],
    "common_traps": [
      "Nhầm giữa quan hệ phần tử thuộc tập (thuộc) và tập con (chứa trong)",
      "Quên xét trường hợp mút vuông hay tròn khi kiểm tra giao khác rỗng"
    ],
    "examples": [
      {
        "title": "Ví dụ 1: Tìm m để giao hai tập hợp khác rỗng",
        "question": "Cho \\(A = [m; m+3]\\) và \\(B = (2; 6)\\). Tìm tất cả giá trị thực của tham số \\(m\\) để \\(A \\cap B \\ne \\emptyset\\).",
        "solution_steps": [
          "Bước 1: Xác định điều kiện hai khoảng/đoạn giao khác rỗng: đầu mút trái của tập này phải nhỏ hơn đầu mút phải của tập kia.",
          "Bước 2: Ta có hệ bất phương trình: \\(m < 6\\) và \\(m + 3 > 2\\).",
          "Bước 3: Suy ra \\(-1 < m < 6\\). Do \\(A\\) là đoạn nên tại các mút: nếu \\(m=6\\) thì \\(A=[6;9]\\), giao với \\(B\\) bằng rỗng. Vậy \\(m \\in (-1; 6)\\)."
        ],
        "takeaway": "Sử dụng trục số để biểu diễn mút: [a, b] và (c, d) giao nhau khi max(a, c) < min(b, d)."
      }
    ],
    "applications": "Ứng dụng trong việc thiết lập câu lệnh truy vấn cơ sở dữ liệu (SQL INTERSECT / UNION), kiểm tra điều kiện kích hoạt trong hệ thống nhúng và biểu diễn không gian mẫu xác suất.",
    "drill_tags": [
      "Tập hợp",
      "Mệnh đề",
      "Logic"
    ],
    "related_question_ids": [
      "q_tsa_06",
      "q_hsa_03",
      "q_tsa_36"
    ]
  },
  {
    "id": "kb_toan10_02",
    "grade": "Toán 10",
    "chapter": "Chương 2: Bất phương trình & Bất đẳng thức",
    "title": "Bất phương trình, Quy hoạch tuyến tính & Bất đẳng thức AM-GM, Cauchy-Schwarz",
    "overview": "Phương pháp biểu diễn miền nghiệm đa giác, tìm cực trị hàm mục tiêu tuyến tính và kỹ thuật chứng minh bất đẳng thức thực chiến.",
    "theory_markdown": "### 1. Bất phương trình bậc nhất hai ẩn & Quy hoạch tuyến tính\nDạng tổng quát: \\(ax + by + c \\le 0\\) (với \\(a^2 + b^2 > 0\\)).\n- Miền nghiệm là một nửa mặt phẳng kể cả bờ là đường thẳng \\(d: ax + by + c = 0\\).\n- **Định lý tối ưu trên miền đa giác**: Cho hàm mục tiêu \\(F(x, y) = ax + by\\). Nếu miền nghiệm của hệ bất phương trình là một đa giác lồi \\(A_1A_2\\dots A_n\\), thì giá trị lớn nhất và giá trị nhỏ nhất của \\(F(x, y)\\) luôn đạt tại một trong các đỉnh của đa giác.\n\n### 2. Bất đẳng thức AM-GM (Cauchy)\nCho các số thực không âm \\(a_1, a_2, \\dots, a_n \\ge 0\\):\n\\[\\frac{a_1 + a_2 + \\dots + a_n}{n} \\ge \\sqrt[n]{a_1 a_2 \\dots a_n}\\]\nDấu bằng xảy ra khi và chỉ khi \\(a_1 = a_2 = \\dots = a_n\\).\n\n### 3. Bất đẳng thức Cauchy-Schwarz (Bunhiacopxki) & Kỹ thuật Engel\nCho hai dãy số thực \\((a_1, \\dots, a_n)\\) và \\((b_1, \\dots, b_n)\\):\n\\[(a_1 b_1 + \\dots + a_n b_n)^2 \\le (a_1^2 + \\dots + a_n^2)(b_1^2 + \\dots + b_n^2)\\]\n- **Dạng phân thức Engel (Svac-xơ)** với \\(x_i > 0\\):\n\\[\\frac{a_1^2}{x_1} + \\frac{a_2^2}{x_2} + \\dots + \\frac{a_n^2}{x_n} \\ge \\frac{(a_1 + a_2 + \\dots + a_n)^2}{x_1 + x_2 + \\dots + x_n}\\]",
    "formulas": [
      {
        "id": "kb_toan10_02_f1",
        "name": "Hàm mục tiêu tuyến tính",
        "latex": "F(x, y) = ax + by + c \\implies \\max F = \\max_{i=1}^n \\{F(A_i)\\}",
        "desc": "Cực trị tuyến tính trên miền đa giác luôn đạt tại một trong các đỉnh",
        "tags": [
          "Quy hoạch tuyến tính",
          "Đỉnh đa giác"
        ],
        "constraints": [
          "Áp dụng trong tập xác định chuẩn của các hàm số thành phần"
        ]
      },
      {
        "id": "kb_toan10_02_f2",
        "name": "Bất đẳng thức AM-GM (Cauchy) 2 số & 3 số",
        "latex": "a + b \\ge 2\\sqrt{ab} \\; (a, b \\ge 0), \\quad a + b + c \\ge 3\\sqrt[3]{abc} \\; (a, b, c \\ge 0) \\quad (\\text{Dấu '=' } \\iff a = b = c)",
        "desc": "Bất đẳng thức giữa trung bình cộng và trung bình nhân cho các số thực không âm",
        "tags": [
          "Bất đẳng thức",
          "AM-GM",
          "Cauchy"
        ],
        "constraints": [
          "Các biến số a, b, c \\ge 0 (không âm)",
          "Dấu '=' xảy ra khi và chỉ khi a = b = c"
        ]
      },
      {
        "id": "kb_toan10_02_f3",
        "name": "Bất đẳng thức Cauchy-Schwarz (Bunhiacopxki) & Dạng Engel",
        "latex": "(ax + by)^2 \\le (a^2 + b^2)(x^2 + y^2), \\quad \\frac{a^2}{x} + \\frac{b^2}{y} \\ge \\frac{(a+b)^2}{x+y} \\; (x, y > 0)",
        "desc": "Bất đẳng thức tích vô hướng và kỹ thuật cộng mẫu số Engel (Svac-xơ)",
        "tags": [
          "Bất đẳng thức",
          "Bunhiacopxki",
          "Cauchy-Schwarz"
        ],
        "constraints": [
          "Các biến số a, b, c \\ge 0 (không âm)",
          "Dấu '=' xảy ra khi và chỉ khi a = b = c"
        ]
      }
    ],
    "formula_ids": [
      "kb_toan10_02_f1",
      "kb_toan10_02_f2",
      "kb_toan10_02_f3"
    ],
    "prerequisites": [
      "kb_toan10_01"
    ],
    "related_topics": [
      "kb_toan10_03",
      "kb_toan11_01"
    ],
    "common_traps": [
      "Áp dụng bất đẳng thức AM-GM khi các biến chưa được chứng minh là số không âm",
      "Quên kiểm tra điều kiện dấu bằng xảy ra trong bài toán tìm cực trị",
      "Chọn sai đỉnh khi giải quy hoạch tuyến tính trên miền không bị chặn"
    ],
    "examples": [
      {
        "title": "Ví dụ 1: Tối ưu hóa chi phí sản xuất",
        "question": "Một phân xưởng sản xuất 2 loại sản phẩm A và B. Lợi nhuận mỗi tấn A là 4 triệu, mỗi tấn B là 3 triệu. Miền ràng buộc nguyên liệu tạo thành tứ giác có tọa độ 4 đỉnh \\(O(0,0), P(0,4), Q(3,2), R(4,0)\\). Tìm lợi nhuận tối đa.",
        "solution_steps": [
          "Bước 1: Hàm mục tiêu: \\(L(x, y) = 4x + 3y\\).",
          "Bước 2: Tính giá trị tại 4 đỉnh: \\(L(O) = 0\\), \\(L(P) = 4(0) + 3(4) = 12\\), \\(L(Q) = 4(3) + 3(2) = 18\\), \\(L(R) = 4(4) + 3(0) = 16\\).",
          "Bước 3: So sánh: \\(\\max L = 18\\) triệu đồng, đạt tại \\(Q(3, 2)\\)."
        ],
        "takeaway": "Chỉ cần tính giá trị hàm mục tiêu tại các đỉnh, không cần xét các điểm trong."
      }
    ],
    "applications": "Mô hình quy hoạch tuyến tính ứng dụng trong logistic, lập kế hoạch ngân sách quảng cáo đa kênh, phối trộn thức ăn chăn nuôi và tối ưu hóa năng lực máy móc.",
    "drill_tags": [
      "Quy hoạch tuyến tính",
      "Hệ BPT",
      "Tối ưu hóa",
      "Bất đẳng thức"
    ],
    "related_question_ids": [
      "q_tsa_09",
      "q_tsa_22",
      "q_hsa_18"
    ]
  },
  {
    "id": "kb_toan10_03",
    "grade": "Toán 10",
    "chapter": "Chương 3: Hàm số bậc hai & Tam thức bậc hai",
    "title": "Hàm số bậc hai, Định lý dấu Tam thức & Ứng dụng Parabol",
    "overview": "Khảo sát đồ thị parabol, tọa độ đỉnh, định lý dấu tam thức bậc hai, định lý Viète và mô hình quỹ đạo parabol.",